{
  "id": "6f1c2a4e-1111-4b8a-9a1b-123456789abc",
  "version": "1.0",
  "task_id": "6f1c2a4e-0000-4b8a-9a1b-123456789abc",
  "run_id": "6f1c2a4e-2222-4b8a-9a1b-123456789abc",
  "title": "Create a repository in Gitea",
  "task": "Create a repository",
  "target": {
    "app": "gitea",
    "base_url": "http://localhost:3001"
  },
  "target_app": "gitea",
  "target_url": "http://localhost:3001",
  "status": "verified",
  "confidence": 0.98,
  "preconditions": {
    "logged_in_as": "demo"
  },
  "viewport": {
    "width": 1280,
    "height": 800,
    "device_scale_factor": 1.0
  },
  "recording": {
    "rrweb": "artifacts/run-1/rrweb.json",
    "path": "artifacts/run-1/rrweb.json",
    "event_count": 120,
    "started_at": "2026-10-06T12:00:00Z",
    "ended_at": "2026-10-06T12:01:00Z"
  },
  "recording_path": "artifacts/run-1/rrweb.json",
  "steps": [
    {
      "id": "11111111-1111-4111-8111-111111111111",
      "workflow_id": "6f1c2a4e-1111-4b8a-9a1b-123456789abc",
      "seq": 1,
      "action": {
        "type": "click",
        "value": null
      },
      "target": {
        "role": "menu",
        "name": "Create…",
        "selector": null,
        "bbox": [1146, 6, 56, 36]
      },
      "instruction_text": "Open the + menu at the top right.",
      "expected_state": {
        "url_matches": "^/$",
        "visible": [
          {
            "role": "menuitem",
            "name": "New Repository"
          }
        ]
      },
      "observed_state": {
        "url": "/",
        "title": "demo - Dashboard - Gitea: Git with a cup of tea",
        "headings": ["Repositories 0", "My Organizations 0"],
        "aria_excerpt": "- main: menu: img 'demo'",
        "screenshot": "artifacts/run-1/step-1.png",
        "captured_at": "2026-10-06T12:00:05Z"
      },
      "verification": {
        "result": "verified",
        "method": ["aria"],
        "confidence": 1.0
      },
      "risk": "low",
      "sensitive": false,
      "timing": {
        "start_ms": 2718,
        "end_ms": 3047
      },
      "start_ms": 2718,
      "end_ms": 3047
    },
    {
      "id": "22222222-2222-4222-8222-222222222222",
      "workflow_id": "6f1c2a4e-1111-4b8a-9a1b-123456789abc",
      "seq": 2,
      "action": {
        "type": "fill",
        "value": "demo-repo"
      },
      "target": {
        "role": "textbox",
        "name": "Repository Name *",
        "selector": "#repo_name",
        "bbox": [400, 300, 250, 40]
      },
      "instruction_text": "Type the repository name.",
      "expected_state": {
        "url_matches": "^/repo/create$",
        "field_values": [
          {
            "role": "textbox",
            "name": "Repository Name *",
            "value": "demo-repo"
          }
        ]
      },
      "observed_state": {
        "url": "/repo/create",
        "title": "New Repository - Gitea: Git with a cup of tea",
        "screenshot": "artifacts/run-1/step-2.png"
      },
      "verification": {
        "result": "verified",
        "method": ["url", "dom"],
        "confidence": 0.98
      },
      "risk": "low",
      "sensitive": false,
      "timing": {
        "start_ms": 3500,
        "end_ms": 4200
      }
    }
  ],
  "created_at": "2026-10-06T12:00:00Z",
  "updated_at": "2026-10-06T12:05:00Z"
}
